{
  "schema_version": "x07.website.package-index@0.2.0",
  "name": "ext-rand",
  "version": "0.1.0",
  "description": "OS CSPRNG (secure random bytes) for OS worlds (run-os only).",
  "docs": "OS-backed cryptographically secure random bytes (run-os only).\n\nModules:\n- std.os.rand\n- std.os.rand.spec\n\nUsage:\n- Add dependency: x07 pkg add ext-rand@0.1.0\n- Import the modules listed above.\n",
  "module_root": "modules",
  "meta": {
    "determinism_tier": "os-world-only",
    "worlds_allowed": [
      "run-os",
      "run-os-sandboxed"
    ],
    "import_mode": "handwritten"
  },
  "modules": [
    {
      "module_id": "std.os.rand",
      "path": "std/os/rand.x07.json",
      "exports": [
        "std.os.rand.bytes_v1",
        "std.os.rand.u64_v1"
      ]
    },
    {
      "module_id": "std.os.rand.spec",
      "path": "std/os/rand/spec.x07.json",
      "exports": [
        "std.os.rand.spec.caps_default_v1",
        "std.os.rand.spec.caps_flags_v1",
        "std.os.rand.spec.caps_max_bytes_per_call_v1",
        "std.os.rand.spec.caps_pack_v1",
        "std.os.rand.spec.caps_version_v1",
        "std.os.rand.spec.err_bad_arg_v1",
        "std.os.rand.spec.err_bad_caps_v1",
        "std.os.rand.spec.err_disabled_v1",
        "std.os.rand.spec.err_io_v1",
        "std.os.rand.spec.err_policy_deny_v1"
      ]
    }
  ]
}
