{
  "schema_version": "x07.website.package-index@0.2.0",
  "name": "ext-time-rs",
  "version": "0.1.6",
  "description": "Time utilities: durations, RFC 3339, and time zones (run-os only).",
  "docs": "Time utilities: durations, RFC 3339, and time zones (run-os only).\n\nModules:\n- ext.time.duration\n- ext.time.rfc3339\n- ext.time.civil\n- ext.time.instant\n- ext.time.tzdb\n- ext.time.os\n- ext.time.rfc3339.tests\n- ext.time.duration.tests\n\nUsage:\n- Add dependency: x07 pkg add ext-time-rs@0.1.6\n- Import the modules listed above.\n",
  "module_root": "modules",
  "meta": {
    "determinism_tier": "os-world-only",
    "worlds_allowed": [
      "run-os",
      "run-os-sandboxed"
    ],
    "import_mode": "handwritten"
  },
  "modules": [
    {
      "module_id": "ext.time.civil",
      "path": "ext/time/civil.x07.json",
      "exports": [
        "ext.time.civil.code_before_epoch",
        "ext.time.civil.code_invalid_doc",
        "ext.time.civil.code_invalid_param",
        "ext.time.civil.code_out_of_range",
        "ext.time.civil.day_i32",
        "ext.time.civil.err_code",
        "ext.time.civil.from_ts_v1",
        "ext.time.civil.from_unix_s_v1",
        "ext.time.civil.hour_i32",
        "ext.time.civil.is_err",
        "ext.time.civil.is_ok",
        "ext.time.civil.make_v1",
        "ext.time.civil.minute_i32",
        "ext.time.civil.month_i32",
        "ext.time.civil.nanos_u32",
        "ext.time.civil.offset_s",
        "ext.time.civil.second_i32",
        "ext.time.civil.to_ts_v1",
        "ext.time.civil.unix_s_hi_u32",
        "ext.time.civil.unix_s_lo_u32",
        "ext.time.civil.ver",
        "ext.time.civil.weekday_iso_v1",
        "ext.time.civil.year_i32"
      ]
    },
    {
      "module_id": "ext.time.duration",
      "path": "ext/time/duration.x07.json",
      "exports": [
        "ext.time.duration.SPEC_ERR_DUR_BAD_NANOS",
        "ext.time.duration.SPEC_ERR_DUR_BAD_TAG",
        "ext.time.duration.SPEC_ERR_DUR_BAD_VER",
        "ext.time.duration.SPEC_ERR_DUR_RANGE",
        "ext.time.duration.SPEC_ERR_DUR_TRUNCATED",
        "ext.time.duration.add_v1",
        "ext.time.duration.err_code_v1",
        "ext.time.duration.from_nanos_v1",
        "ext.time.duration.from_secs_i32_v1",
        "ext.time.duration.from_secs_u32_v1",
        "ext.time.duration.is_err_v1",
        "ext.time.duration.make_v1",
        "ext.time.duration.nanos_v1",
        "ext.time.duration.secs_hi_v1",
        "ext.time.duration.secs_lo_v1",
        "ext.time.duration.sub_v1",
        "ext.time.duration.ver_v1"
      ]
    },
    {
      "module_id": "ext.time.duration.tests",
      "path": "ext/time/duration/tests.x07.json",
      "exports": [
        "ext.time.duration.tests.test_add_invalid_doc",
        "ext.time.duration.tests.test_add_nanos_carry",
        "ext.time.duration.tests.test_add_ok",
        "ext.time.duration.tests.test_add_overflow",
        "ext.time.duration.tests.test_make_invalid_nanos",
        "ext.time.duration.tests.test_sub_nanos_borrow",
        "ext.time.duration.tests.test_sub_ok",
        "ext.time.duration.tests.test_sub_underflow"
      ]
    },
    {
      "module_id": "ext.time.instant",
      "path": "ext/time/instant.x07.json",
      "exports": [
        "ext.time.instant.SPEC_ERR_INSTANT_FROM_RFC3339",
        "ext.time.instant.add_duration_v1",
        "ext.time.instant.err_code_v1",
        "ext.time.instant.from_rfc3339_doc_v1",
        "ext.time.instant.is_err_v1",
        "ext.time.instant.make_v1",
        "ext.time.instant.nanos_u32_v1",
        "ext.time.instant.sub_instant_v1",
        "ext.time.instant.unix_s_hi_v1",
        "ext.time.instant.unix_s_lo_v1"
      ]
    },
    {
      "module_id": "ext.time.os",
      "path": "ext/time/os.x07.json",
      "exports": [
        "ext.time.os.local_tzid_v1",
        "ext.time.os.now_instant_v1",
        "ext.time.os.now_rfc3339_utc_v1",
        "ext.time.os.sleep_ms_v1"
      ]
    },
    {
      "module_id": "ext.time.rfc3339",
      "path": "ext/time/rfc3339.x07.json",
      "exports": [
        "ext.time.rfc3339._days_in_month",
        "ext.time.rfc3339._days_since_epoch_1970",
        "ext.time.rfc3339._is_leap_year",
        "ext.time.rfc3339._u64_add_hi",
        "ext.time.rfc3339._u64_add_lo",
        "ext.time.rfc3339._u64_div_mod_u32_small",
        "ext.time.rfc3339._u64_mul_u32_hi",
        "ext.time.rfc3339._u64_mul_u32_lo",
        "ext.time.rfc3339._u64_sub_hi",
        "ext.time.rfc3339._u64_sub_lo",
        "ext.time.rfc3339.err_code",
        "ext.time.rfc3339.format_doc_v1",
        "ext.time.rfc3339.format_v1",
        "ext.time.rfc3339.is_err",
        "ext.time.rfc3339.nanos_u32",
        "ext.time.rfc3339.offset_s",
        "ext.time.rfc3339.parse_v1",
        "ext.time.rfc3339.tzid",
        "ext.time.rfc3339.unix_s_i64_hi",
        "ext.time.rfc3339.unix_s_u32"
      ]
    },
    {
      "module_id": "ext.time.rfc3339.tests",
      "path": "ext/time/rfc3339/tests.x07.json",
      "exports": [
        "ext.time.rfc3339.tests.test_format_epoch_z",
        "ext.time.rfc3339.tests.test_format_frac_nanos_123",
        "ext.time.rfc3339.tests.test_format_invalid_offset_not_multiple_of_60",
        "ext.time.rfc3339.tests.test_format_offset_minus_0030",
        "ext.time.rfc3339.tests.test_format_v2_u32_overflow_ok",
        "ext.time.rfc3339.tests.test_parse_epoch_z",
        "ext.time.rfc3339.tests.test_parse_frac_nanos_123",
        "ext.time.rfc3339.tests.test_parse_invalid_space_instead_of_t",
        "ext.time.rfc3339.tests.test_parse_ixdtf_tzid",
        "ext.time.rfc3339.tests.test_parse_offset_minus_0030",
        "ext.time.rfc3339.tests.test_parse_v2_u32_overflow_ok",
        "ext.time.rfc3339.tests.test_roundtrip_v2_9999"
      ]
    },
    {
      "module_id": "ext.time.tzdb",
      "path": "ext/time/tzdb.x07.json",
      "exports": [
        "ext.time.tzdb.SPEC_ERR_TZDB_INTERNAL",
        "ext.time.tzdb.SPEC_ERR_TZDB_INVALID_TZID",
        "ext.time.tzdb.SPEC_ERR_TZDB_RANGE",
        "ext.time.tzdb.is_valid_tzid_v1",
        "ext.time.tzdb.offset_duration_v1",
        "ext.time.tzdb.offset_from_rfc3339_doc_v1",
        "ext.time.tzdb.snapshot_id_v1"
      ]
    }
  ]
}
