{
  "schema_version": "x07.website.package-index@0.2.0",
  "name": "ext-msgpack-rs",
  "version": "0.1.7",
  "description": "MessagePack encode/decode with ext.data_model integration.",
  "docs": "MessagePack encode/decode with ext.data_model integration.\n\nModules:\n- ext.msgpack\n- ext.msgpack.data_model\n- ext.msgpack.tests\n\nUsage:\n- Add dependency: x07 pkg add ext-msgpack-rs@0.1.7 --sync\n- Import ext.msgpack.data_model.\n\nNotes:\n- Determinism: pure\n- Data model integration: ext.msgpack.data_model\n- Numbers beyond i32 range are encoded via MessagePack ext types.\n",
  "module_root": "modules",
  "meta": {
    "determinism_tier": "pure",
    "worlds_allowed": [
      "solve-pure",
      "solve-fs",
      "solve-rr",
      "solve-kv",
      "solve-full",
      "run-os",
      "run-os-sandboxed"
    ],
    "requires_packages": [
      "ext-data-model@0.1.9",
      "ext-error@0.1.4",
      "ext-bigint-rs@0.1.2",
      "ext-decimal-rs@0.1.2"
    ],
    "import_mode": "handwritten"
  },
  "modules": [
    {
      "module_id": "ext.msgpack",
      "path": "ext/msgpack.x07.json",
      "exports": [
        "ext.msgpack.decode_data_model_v1",
        "ext.msgpack.encode_data_model_v1"
      ]
    },
    {
      "module_id": "ext.msgpack.data_model",
      "path": "ext/msgpack/data_model.x07.json",
      "exports": [
        "ext.msgpack.data_model.emit_v1",
        "ext.msgpack.data_model.err_code",
        "ext.msgpack.data_model.get_bytes",
        "ext.msgpack.data_model.is_err",
        "ext.msgpack.data_model.parse_v1"
      ]
    },
    {
      "module_id": "ext.msgpack.tests",
      "path": "ext/msgpack/tests.x07.json",
      "exports": [
        "ext.msgpack.tests.test_data_model_roundtrip",
        "ext.msgpack.tests.test_data_model_vectors",
        "ext.msgpack.tests.test_vector_0",
        "ext.msgpack.tests.test_vector_123",
        "ext.msgpack.tests.test_vector_big_neg",
        "ext.msgpack.tests.test_vector_big_pos",
        "ext.msgpack.tests.test_vector_dec_1_23",
        "ext.msgpack.tests.test_vector_hi",
        "ext.msgpack.tests.test_vector_map_len_b_aa",
        "ext.msgpack.tests.test_vector_neg1"
      ]
    }
  ]
}
