{
  "schema_version": "x07.website.package-index@0.2.0",
  "name": "ext-tracing",
  "version": "0.1.4",
  "description": "Trace span/event record encoding and formatting.",
  "docs": "Trace span/event record encoding and formatting.\n\nModules:\n- ext.tracing\n- ext.tracing.tests\n\nUsage:\n- Add dependency: x07 pkg add ext-tracing@0.1.4\n- Import the modules listed above.\n",
  "module_root": "modules",
  "meta": {
    "determinism_tier": "pure",
    "worlds_allowed": [
      "solve-pure",
      "solve-fs",
      "solve-rr",
      "solve-kv",
      "solve-full",
      "run-os",
      "run-os-sandboxed"
    ],
    "import_mode": "handwritten"
  },
  "modules": [
    {
      "module_id": "ext.tracing",
      "path": "ext/tracing.x07.json",
      "exports": [
        "ext.tracing.event_is_valid_record",
        "ext.tracing.event_record",
        "ext.tracing.event_record_level",
        "ext.tracing.event_record_msg",
        "ext.tracing.event_record_name",
        "ext.tracing.event_record_span_id",
        "ext.tracing.format_event_record",
        "ext.tracing.format_span_record",
        "ext.tracing.level_debug",
        "ext.tracing.level_error",
        "ext.tracing.level_info",
        "ext.tracing.level_name",
        "ext.tracing.level_trace",
        "ext.tracing.level_warn",
        "ext.tracing.span_id",
        "ext.tracing.span_is_valid_record",
        "ext.tracing.span_record",
        "ext.tracing.span_record_id",
        "ext.tracing.span_record_name",
        "ext.tracing.span_record_parent"
      ]
    },
    {
      "module_id": "ext.tracing.tests",
      "path": "ext/tracing/tests.x07.json",
      "exports": [
        "ext.tracing.tests.test_event_roundtrip_and_format",
        "ext.tracing.tests.test_invalid_records",
        "ext.tracing.tests.test_span_roundtrip_and_format"
      ]
    }
  ]
}
